claim_id,category,proposed_claim_kr,proposed_claim_en,status,evidence_type,owner,upstream_repository,upstream_commit,evidence_path,scope,limitations,allowed_report_sections
CLM-044,benchmark_active_core,"FPGA active-core는 profile total에서 RUN-state input wait를 뺀 3601290 cycles이며 100 MHz에서 36.012900 ms와 49982089.751172 samples per second이다","FPGA active-core time is 3601290 cycles after subtracting RUN-state input wait from profile total corresponding to 36.012900 ms and 49982089.751172 samples per second at 100 MHz",CAREFUL,derived from two measured board hardware counters with XSim cross-check,양건,https://github.com/Sheep-gun/SNN-ECG-4-Class-Classifier,95d7966c32ec0bad7af2dca4aa23e7e638a9103a,benchmarks/accelerator_benefit/results/board_timing_summary.json,FPGA accelerator active-core stored-data processing,"core scope and locked counter semantics; not integrated-system latency or live observation time","benchmark; 결과; 한계"
CLM-045,benchmark_speedup,"Exact C++ kernel 1777.699800 ms를 FPGA active-core 36.012900 ms로 나눈 speedup은 49.362861641x이다","Exact C++ kernel latency of 1777.699800 ms divided by FPGA active-core latency of 36.012900 ms gives a speedup of 49.362861641x",CAREFUL,measured CPU divided by latency derived from measured board counters,양건,https://github.com/Sheep-gun/SNN-ECG-4-Class-Classifier,95d7966c32ec0bad7af2dca4aa23e7e638a9103a,benchmarks/accelerator_benefit/results/integrated_benchmark_summary.csv,stored-data kernel-to-active-core comparison,"core scope only; integrated-system speedup requires preloaded input and an independent timer","benchmark; 결과; 한계"
CLM-046,benchmark_power_energy,"Post-implementation vectorless Vivado 추정전력은 Pure RTL 0.099 W와 MicroBlaze 통합 시스템 0.271 W이며 Pure RTL active energy는 0.003565277100 J per decision이다; integrated-system energy는 미측정이다","Post-implementation vectorless Vivado power is estimated at 0.099 W for Pure RTL and 0.271 W for the MicroBlaze system; Pure RTL active energy is 0.003565277100 J per decision while integrated-system energy is not measured",CAREFUL,estimated power and valid derived active-core energy,양건,https://github.com/Sheep-gun/SNN-ECG-4-Class-Classifier,95d7966c32ec0bad7af2dca4aa23e7e638a9103a,benchmarks/accelerator_benefit/results/power_energy_summary.csv,implementation on-chip estimate and core active energy,"not physical board input power or measured energy; integrated-system energy unavailable; no SAIF or VCD; Medium confidence","benchmark; 결과; 한계"
CLM-047,benchmark_equivalence_gate,"Exact C++ 성능 측정 전 36/36 final prediction 144/144 final membrane 1080/1080 Snapshot boundary 등가성을 확인했고 실보드에서도 36/36 및 144/144 정합을 재확인했다","The benchmark verified 36/36 final predictions 144/144 final membranes and 1080/1080 Snapshot boundaries before Exact C++ timing and reconfirmed 36/36 and 144/144 on hardware",SAFE,post-benchmark and measured board equivalence,양건,https://github.com/Sheep-gun/SNN-ECG-4-Class-Classifier,95d7966c32ec0bad7af2dca4aa23e7e638a9103a,benchmarks/accelerator_benefit/results/board_timing_summary.json,Exact C++ semantic and board replay gate,"functional equivalence does not change classification accuracy","benchmark; 결과"
CLM-048,rtl_timing_history,"고정 RTL에 이르는 개발 이력에서 class_score_neurons의 RDM-to-prediction 병목을 구조적 pipeline으로 분할하고 timing 재검증과 Python RTL FPGA 기능 등가성을 확인했다","The development history leading to the fixed RTL structurally pipelines the class_score_neurons RDM-to-prediction bottleneck and verifies timing plus Python RTL and FPGA functional equivalence",CAREFUL,curated Git-history audit and final implementation evidence,양건,https://github.com/Sheep-gun/SNN-ECG-4-Class-Classifier,"c7c75cfebf7add12bfcc32bb59d5edf38ac6e5aa;5e2e5d0a46be47d8086b8642e055066079bfa4e6;c6b80de19cdcad5b7e43fe7835588b629d847f75",docs/RTL_TIMING_OPTIMIZATION_HISTORY_KR.md,historical bottleneck analysis through fixed RTL,"c7c75cf and 5e2e5d0 are ancestor history; historical OOC timing and the roughly 17.5k LUT hotspot are not final implementation metrics and are not directly comparable with final 9719 LUT","5.6 RTL/IP/FPGA 구현; 8.1 설계적 차별성; hardware docs"
CLM-049,ltspice_nominal_verification,"XMODEL-aligned LTspice schematic의 35개 실행은 모두 완료됐고 HPF 0.481174 Hz IA 200.594 V/V 60 Hz notch -83.557 dB LPF 150.211 Hz와 clipping 0을 확인했다","All 35 XMODEL-aligned LTspice runs completed and measured HPF 0.481174 Hz IA 200.594 V per V 60 Hz notch minus 83.557 dB LPF 150.211 Hz and zero clipping",CAREFUL,LTspice schematic simulation and compact result tables,이수환,TEAM_HANDOFF,INTEGRATED_LTSPICE_2026-07-19,validation/afe_ltspice_xmodel_aligned/tables/xmodel_aligned_execution_manifest.csv,LTspice 26.0.1 schematic-level nominal and stress verification,"model and abstraction based; not physical PCB transistor-level post-layout or silicon measurement","초록; 3; 4.1; 7.2; 결론; 부록"
CLM-050,ltspice_xmodel_correlation,"동일한 10초 ECG 10000표본의 LTspice S/H와 XMODEL signed ADC 비교는 MAE 0.6445 LSB RMS 1.3020 LSB maximum 13 LSB correlation 0.999518 best lag 0과 clipping 0이었다","For the same ten-second ECG and 10000 samples the LTspice sample-hold versus XMODEL signed ADC comparison had MAE 0.6445 LSB RMS 1.3020 LSB maximum 13 LSB correlation 0.999518 best lag zero and zero clipping",CAREFUL,team handoff ADC correlation table and figures,이수환,TEAM_HANDOFF,INTEGRATED_LTSPICE_2026-07-19,validation/afe_ltspice_xmodel_aligned/tables/xmodel_ltspice_handoff_metrics.csv,patient100 nominal 10 seconds at 1 kSPS signed 12 bit,"representative nominal case; distinct analog solvers are not sample-wise bit exact","초록; 4.2; 7.2; 결론; 부록"
CLM-051,ltspice_xmodel_error_coverage,"LTspice와 XMODEL의 10000개 ADC code 중 98.74%는 ±5 LSB 99.89%는 ±10 LSB 이내였다","Of 10000 LTspice and XMODEL ADC codes 98.74 percent were within plus or minus 5 LSB and 99.89 percent were within plus or minus 10 LSB",CAREFUL,team handoff cumulative code-error coverage,이수환,TEAM_HANDOFF,INTEGRATED_LTSPICE_2026-07-19,validation/afe_ltspice_xmodel_aligned/tables/xmodel_ltspice_handoff_metrics.csv,patient100 nominal 10 seconds at 1 kSPS signed 12 bit,"11 samples exceed 10 LSB and the maximum is 13 LSB; coverage is not bit-exact identity","초록; 4.2; 7.2; 결론; 부록"
CLM-052,analog_validation_chain,"아날로그 검증 흐름은 MATLAB 공칭 설계에서 LTspice schematic 구현 검증을 거쳐 SystemVerilog XMODEL 행동모델과 signed RTL 인계로 이어진다","The analog verification flow proceeds from MATLAB nominal design through LTspice schematic implementation verification to the SystemVerilog XMODEL behavioral model and signed RTL handoff",CAREFUL,cross-stage validation report and handoff artifacts,team,INTEGRATED,INTEGRATED_CURATED,docs/MIXED_SIGNAL_VERIFICATION_KR.md,model-based mixed-signal validation chain,"does not replace physical electrode PCB ADC post-layout or silicon validation","README; 초록; 2; 3; 4; 6; 7; 결론"
